{
  "proofId": "M5_ROTO_BRUSH_PROPAGATION_FORWARD_RETAINED_REAL_AE_V1",
  "proofScript": "scripts/windows/run-m5-roto-brush-propagation-live-proof.ps1",
  "lifecycle": "REUSE_AE",
  "artifactDir": "proofs/artifacts/m5-roto-brush-propagation-forward-live-proof",
  "timeoutSeconds": 180,
  "resultFile": "result.json",
  "proofStrategy": "INCREMENTAL_FIRST",
  "incrementalNodeId": "M5:ROTO:PROPAGATION:FORWARD",
  "checkpointKey": "M5:ROTO:SEEDED_SESSION:V1",
  "allowEvidenceReuse": true,
  "incrementalDependencies": [
    "scripts/windows/run-m5-roto-brush-propagation-live-proof.ps1",
    "scripts/windows/m5-roto-brush-isolation-enter.jsx",
    "scripts/windows/m5-roto-brush-isolation-restore.jsx",
    "scripts/windows/run-m5-roto-brush-proof-preflight.ps1",
    "scripts/windows/m5-roto-brush-proof-preflight.jsx",
    "scripts/windows/m5-roto-brush-fixture-setup.jsx",
    "scripts/windows/m5-roto-brush-readback-dispatch.jsx",
    "scripts/m5-roto-brush-propagation-live-proof.mjs",
    "packages/adapters/ae-cep/src/m5-roto-brush-propagation-controller.ts",
    "packages/adapters/ae-cep/src/m5-editgpt-roto-brush-propagation-visual-driver.ts",
    "packages/adapters/ae-cep/src/m5-roto-brush-seed-controller.ts",
    "packages/adapters/ae-cep/src/m5-editgpt-roto-brush-seed-visual-driver.ts",
    "packages/adapters/ae-cep/src/m4-editgpt-tracker-visual-driver.ts",
    "packages/adapters/ae-cep/runtime/editgpt_roto_brush_propagation_visual_driver.py",
    "packages/adapters/ae-cep/runtime/editgpt_roto_brush_seed_visual_driver.py"
  ],
  "focusedTests": [
    "tests/m5-roto-brush-propagation-controller.test.mjs",
    "tests/m5-editgpt-roto-brush-propagation-visual-driver.test.mjs",
    "tests/m5-roto-brush-propagation-live-proof-harness.test.mjs",
    "tests/m5-roto-brush-proof-gate.test.mjs",
    "tests/m5-editgpt-roto-brush-seed-visual-driver.test.mjs"
  ]
}
