{
  "proofId": "m4-segmentation-matte-materialization-real-ae",
  "lifecycle": "REUSE_AE",
  "timeoutSeconds": 90,
  "proofScript": "scripts/windows/run-m4-segmentation-matte-materialization.ps1",
  "artifactDir": "proofs/artifacts/m4-segmentation-matte-materialization",
  "resultFile": "result.json",
  "allowInfrastructureRetry": false
}
