{
    "proofId":  "M5_ROTO_BRUSH_REPAIR_STROKE_RETAINED_REAL_AE_V1",
    "proofScript":  "scripts/windows/run-m5-roto-brush-repair-live-proof.ps1",
    "lifecycle":  "REUSE_AE",
    "artifactDir":  "proofs/artifacts/m5-roto-brush-repair-live-proof",
    "timeoutSeconds":  180,
    "resultFile":  "result.json",
    "proofStrategy":  "INCREMENTAL_FIRST",
    "incrementalNodeId":  "M5:ROTO:REPAIR_STROKE",
    "checkpointKey":  "M5:ROTO:REPAIR_STROKE_SESSION:V1",
    "allowEvidenceReuse":  true,
    "incrementalDependencies":  [
                                    "scripts/windows/run-m5-roto-brush-repair-live-proof.ps1",
                                    "scripts/windows/m5-roto-brush-isolation-enter.jsx",
                                    "scripts/windows/m5-roto-brush-isolation-restore.jsx",
                                    "scripts/windows/run-m5-roto-brush-proof-preflight.ps1",
                                    "scripts/windows/m5-roto-brush-fixture-setup.jsx",
                                    "scripts/windows/m5-roto-brush-readback-dispatch.jsx",
                                    "scripts/windows/m5-roto-brush-tool-select.jsx",
                                    "scripts/m5-roto-brush-repair-live-proof.mjs",
                                    "packages/adapters/ae-cep/src/m5-roto-brush-repair-controller.ts",
                                    "packages/adapters/ae-cep/src/m5-editgpt-roto-brush-repair-visual-driver.ts",
                                    "packages/adapters/ae-cep/src/m5-roto-brush-seed-controller.ts",
                                    "packages/adapters/ae-cep/src/m5-editgpt-roto-brush-seed-visual-driver.ts",
                                    "packages/adapters/ae-cep/runtime/editgpt_roto_brush_repair_visual_driver.py",
                                    "packages/adapters/ae-cep/runtime/editgpt_roto_brush_seed_visual_driver.py",
                                    "tests/m5-roto-brush.test.mjs",
                                    "tests/m5-roto-brush-repair-controller.test.mjs",
                                    "tests/m5-editgpt-roto-brush-repair-visual-driver.test.mjs",
                                    "tests/m5-roto-brush-repair-live-proof-harness.test.mjs",
                                    "tests/m5-roto-brush-live-proof-harness.test.mjs",
                                    "packages/adapters/ae-cep/src/m5-roto-brush.ts",
                                    "tests/m5-roto-brush-seed-controller.test.mjs",
                                    "tests/m5-editgpt-roto-brush-seed-visual-driver.test.mjs"
                                ],
    "focusedTests":  [
                         "tests/m5-roto-brush.test.mjs",
                         "tests/m5-roto-brush-repair-controller.test.mjs",
                         "tests/m5-editgpt-roto-brush-repair-visual-driver.test.mjs",
                         "tests/m5-roto-brush-repair-live-proof-harness.test.mjs",
                         "tests/m5-roto-brush-live-proof-harness.test.mjs",
                         "tests/m5-roto-brush-seed-controller.test.mjs",
                         "tests/m5-editgpt-roto-brush-seed-visual-driver.test.mjs"
                     ]
}
